{
  "canonical_url": "https://westkitty.github.io/Starsilk_Character_Dossier/chronology/chronology.json",
  "event_count": 27,
  "events": [
    {
      "canon_status": "unknown",
      "canonical_url": "https://westkitty.github.io/Starsilk_Character_Dossier/chronology/#event-initialization-reality",
      "event_id": "initialization-reality",
      "label": "The Initialization of Reality",
      "source": {
        "canonical_url": "https://westkitty.github.io/Starsilk_Character_Dossier/entities/chronology/",
        "heading": "Phase I — The Primordial Era & The Foundational Betrayals",
        "legacy_url": "https://westkitty.github.io/Starsilk_Character_Dossier/#chronology",
        "path": "src/content/sections/chronology.body.html",
        "source_key": "five-phase-canon-chronology",
        "stable_record_id": "chronology"
      },
      "spoiler_level": "unknown",
      "status_provenance": {
        "canon_status": "no structured event canon status is authored",
        "spoiler_level": "no structured event spoiler level is authored",
        "visibility": "existing public source record"
      },
      "temporal": {
        "absolute_date": null,
        "after_event_ids": [],
        "before_event_ids": [],
        "certainty": "unknown",
        "duration": null,
        "exact_authored_marker": null,
        "relative_marker": null
      },
      "visibility": "public"
    },
    {
      "canon_status": "unknown",
      "canonical_url": "https://westkitty.github.io/Starsilk_Character_Dossier/chronology/#event-triarchic-order",
      "event_id": "triarchic-order",
      "label": "The Triarchic Order",
      "source": {
        "canonical_url": "https://westkitty.github.io/Starsilk_Character_Dossier/entities/chronology/",
        "heading": "Phase I — The Primordial Era & The Foundational Betrayals",
        "legacy_url": "https://westkitty.github.io/Starsilk_Character_Dossier/#chronology",
        "path": "src/content/sections/chronology.body.html",
        "source_key": "five-phase-canon-chronology",
        "stable_record_id": "chronology"
      },
      "spoiler_level": "unknown",
      "status_provenance": {
        "canon_status": "no structured event canon status is authored",
        "spoiler_level": "no structured event spoiler level is authored",
        "visibility": "existing public source record"
      },
      "temporal": {
        "absolute_date": null,
        "after_event_ids": [],
        "before_event_ids": [],
        "certainty": "unknown",
        "duration": null,
        "exact_authored_marker": null,
        "relative_marker": null
      },
      "visibility": "public"
    },
    {
      "canon_status": "unknown",
      "canonical_url": "https://westkitty.github.io/Starsilk_Character_Dossier/chronology/#event-forging-starsilk",
      "event_id": "forging-starsilk",
      "label": "The Forging of Starsilk",
      "source": {
        "canonical_url": "https://westkitty.github.io/Starsilk_Character_Dossier/entities/chronology/",
        "heading": "Phase I — The Primordial Era & The Foundational Betrayals",
        "legacy_url": "https://westkitty.github.io/Starsilk_Character_Dossier/#chronology",
        "path": "src/content/sections/chronology.body.html",
        "source_key": "five-phase-canon-chronology",
        "stable_record_id": "chronology"
      },
      "spoiler_level": "unknown",
      "status_provenance": {
        "canon_status": "no structured event canon status is authored",
        "spoiler_level": "no structured event spoiler level is authored",
        "visibility": "existing public source record"
      },
      "temporal": {
        "absolute_date": null,
        "after_event_ids": [],
        "before_event_ids": [],
        "certainty": "unknown",
        "duration": null,
        "exact_authored_marker": null,
        "relative_marker": null
      },
      "visibility": "public"
    },
    {
      "canon_status": "unknown",
      "canonical_url": "https://westkitty.github.io/Starsilk_Character_Dossier/chronology/#event-primordial-betrayal",
      "event_id": "primordial-betrayal",
      "label": "The Primordial Betrayal",
      "source": {
        "canonical_url": "https://westkitty.github.io/Starsilk_Character_Dossier/entities/chronology/",
        "heading": "Phase I — The Primordial Era & The Foundational Betrayals",
        "legacy_url": "https://westkitty.github.io/Starsilk_Character_Dossier/#chronology",
        "path": "src/content/sections/chronology.body.html",
        "source_key": "five-phase-canon-chronology",
        "stable_record_id": "chronology"
      },
      "spoiler_level": "unknown",
      "status_provenance": {
        "canon_status": "no structured event canon status is authored",
        "spoiler_level": "no structured event spoiler level is authored",
        "visibility": "existing public source record"
      },
      "temporal": {
        "absolute_date": null,
        "after_event_ids": [],
        "before_event_ids": [],
        "certainty": "unknown",
        "duration": null,
        "exact_authored_marker": null,
        "relative_marker": null
      },
      "visibility": "public"
    },
    {
      "canon_status": "unknown",
      "canonical_url": "https://westkitty.github.io/Starsilk_Character_Dossier/chronology/#event-imprisonment-nialbu",
      "event_id": "imprisonment-nialbu",
      "label": "The Imprisonment of NiAlBu",
      "source": {
        "canonical_url": "https://westkitty.github.io/Starsilk_Character_Dossier/entities/chronology/",
        "heading": "Phase I — The Primordial Era & The Foundational Betrayals",
        "legacy_url": "https://westkitty.github.io/Starsilk_Character_Dossier/#chronology",
        "path": "src/content/sections/chronology.body.html",
        "source_key": "five-phase-canon-chronology",
        "stable_record_id": "chronology"
      },
      "spoiler_level": "unknown",
      "status_provenance": {
        "canon_status": "no structured event canon status is authored",
        "spoiler_level": "no structured event spoiler level is authored",
        "visibility": "existing public source record"
      },
      "temporal": {
        "absolute_date": null,
        "after_event_ids": [],
        "before_event_ids": [],
        "certainty": "unknown",
        "duration": null,
        "exact_authored_marker": null,
        "relative_marker": null
      },
      "visibility": "public"
    },
    {
      "canon_status": "unknown",
      "canonical_url": "https://westkitty.github.io/Starsilk_Character_Dossier/chronology/#event-growth-mother",
      "event_id": "growth-mother",
      "label": "The Growth of Mother",
      "source": {
        "canonical_url": "https://westkitty.github.io/Starsilk_Character_Dossier/entities/chronology/",
        "heading": "Phase II — The Pre-War Era & The Great Misunderstanding",
        "legacy_url": "https://westkitty.github.io/Starsilk_Character_Dossier/#chronology",
        "path": "src/content/sections/chronology.body.html",
        "source_key": "five-phase-canon-chronology",
        "stable_record_id": "chronology"
      },
      "spoiler_level": "unknown",
      "status_provenance": {
        "canon_status": "no structured event canon status is authored",
        "spoiler_level": "no structured event spoiler level is authored",
        "visibility": "existing public source record"
      },
      "temporal": {
        "absolute_date": null,
        "after_event_ids": [],
        "before_event_ids": [],
        "certainty": "unknown",
        "duration": null,
        "exact_authored_marker": null,
        "relative_marker": null
      },
      "visibility": "public"
    },
    {
      "canon_status": "unknown",
      "canonical_url": "https://westkitty.github.io/Starsilk_Character_Dossier/chronology/#event-compilation-drakken",
      "event_id": "compilation-drakken",
      "label": "The Compilation of the Drakken",
      "source": {
        "canonical_url": "https://westkitty.github.io/Starsilk_Character_Dossier/entities/chronology/",
        "heading": "Phase II — The Pre-War Era & The Great Misunderstanding",
        "legacy_url": "https://westkitty.github.io/Starsilk_Character_Dossier/#chronology",
        "path": "src/content/sections/chronology.body.html",
        "source_key": "five-phase-canon-chronology",
        "stable_record_id": "chronology"
      },
      "spoiler_level": "unknown",
      "status_provenance": {
        "canon_status": "no structured event canon status is authored",
        "spoiler_level": "no structured event spoiler level is authored",
        "visibility": "existing public source record"
      },
      "temporal": {
        "absolute_date": null,
        "after_event_ids": [],
        "before_event_ids": [],
        "certainty": "unknown",
        "duration": null,
        "exact_authored_marker": null,
        "relative_marker": null
      },
      "visibility": "public"
    },
    {
      "canon_status": "unknown",
      "canonical_url": "https://westkitty.github.io/Starsilk_Character_Dossier/chronology/#event-descent-eggs",
      "event_id": "descent-eggs",
      "label": "The Descent of the Eggs",
      "source": {
        "canonical_url": "https://westkitty.github.io/Starsilk_Character_Dossier/entities/chronology/",
        "heading": "Phase II — The Pre-War Era & The Great Misunderstanding",
        "legacy_url": "https://westkitty.github.io/Starsilk_Character_Dossier/#chronology",
        "path": "src/content/sections/chronology.body.html",
        "source_key": "five-phase-canon-chronology",
        "stable_record_id": "chronology"
      },
      "spoiler_level": "unknown",
      "status_provenance": {
        "canon_status": "no structured event canon status is authored",
        "spoiler_level": "no structured event spoiler level is authored",
        "visibility": "existing public source record"
      },
      "temporal": {
        "absolute_date": null,
        "after_event_ids": [],